{
  "schema_version": 1,
  "suite_id": "r04/live-monitor-v1",
  "status": "passed",
  "command": "integration/r04/live-reproduce.sh",
  "started_at": "2026-09-17T19:11:19Z",
  "finished_at": "2026-09-17T19:11:43Z",
  "source": {
    "repository": "https://github.com/otuschhoff/rados-rs",
    "revision": "2b35f5731c84c7d46a8ef47c587f1a252fa7126b",
    "dirty": false,
    "identity": "content-addressed-artifacts",
    "artifacts": {
      "Cargo.toml": "1a39fecfbb8da23cd591e273c51128fc563f34d03c1a3b0add3ae078822229b9",
      "Cargo.lock": "84ef71a67ad81461e7120eb3f55e3a0fea7dbc64474692364a7d2c9b629b301a",
      "rust-toolchain.toml": "416f4fc79fdd19f5d779c0715cc333fdfa5ced039d0d1449e4b3dfc9f356a31d",
      "integration/r04/live-reproduce.sh": "cdad1254dfc40692bdaf303a336eb7015795bad5516869685e5a6a0fa180ab9a",
      "integration/r04/verify-live-report.sh": "7c08b7a10ba4f8f78fda44f50fe2ebea0cf2b1d7ad025ab8ff192066497f061c",
      "integration/r04/live-report.schema.json": "2eb24e1047a8bc2b2ae2333d7cb554d41523cb9cbf29edfac6d2b6ce19890526",
      "integration/r04/legacy-crush.txt": "5b07d221477e01a50ad37ab113cb8511ada2895bd3e848504518d0ef634f13ea",
      "integration/r04/legacy-crush.provenance.json": "40c06de139ff6fa85da90cdef2162261c3560083640992dbf9836db2fc337d0d",
      "src/bin/rados-r04-live.rs": "721be579266900e8d80bcf8ba6531bedd4b18c4f72b65a2d47e5a05e48dfed3c",
      "src/cephx/connector.rs": "e2bc62b7048f34f6cd608a1919d18efc65eb7980be099d7f9afdb17658d2aeb7",
      "src/cephx/core.rs": "bd4cb0791d1b851a4411a7986a61b63f010ba1ab5ab7a65000b13bb9e476270a",
      "src/cephx/crypto.rs": "84ca6148860491b7f9054805f8cc3bd4dcf0aa3f3ccee848d24c2d2a4183bc91",
      "src/cephx/fixture_tests.rs": "5bcbe9fbddd908d112556af82fc5bcf3daa2d41e1a518cbd17ff0901bcee531a",
      "src/cephx/mod.rs": "d7d78a5fe33418fe86fae5c468ec596494b58848ba4a396a1f7924d0e72b465f",
      "src/client.rs": "c6d6f02c0135b4ebf2363abf5eb4fc8a124d4d939fa56e19f19b1731fe30b6fc",
      "src/config.rs": "4fb4dd45751c2ce02f60492693aedddf05fa2c8949918cd12eccd2ba8a9542ec",
      "src/entity_name.rs": "f87215802a7e312ced4068b31099b09eec918d0c90107316e7a9cc6afe8d0f2b",
      "src/error.rs": "a242ea53af368bb744fff210868283a99122f4c04b87b262a86f7b341dc72632",
      "src/identity.rs": "25b969fd8a28ab767a615298eb7106c1920ed2a7ee7a070aa79f9898204fc219",
      "src/lib.rs": "9b0a6f65efdb31851b794960eafbadea4c3e3cc7e397e1a9d43f40774bce7a92",
      "src/msgr/banner.rs": "18facb1ad47f17ff68caa94aba104b4f9923605caad687259bc2a3b860d0cbc2",
      "src/msgr/control.rs": "f37f5b4e2d99559418b6e9967d12382aec32569ee1b1373522ab9cf3804b2d04",
      "src/msgr/fixture_tests.rs": "a9aef256da4b8e86ab2bb1ac2d9ccf10c976710d93a6382f027b675a44500458",
      "src/msgr/frame.rs": "e0dea72e5b959a0797e482b152343cfec9c8cfaf439d8d93d707e710436dcb9c",
      "src/msgr/message.rs": "7a70a4f679a78420b0a5009718e122cde47bcb06cd4cc8aad5bee40fca58e76b",
      "src/msgr/mod.rs": "f30af93d8ada4b12b10c8a6afe923ee1a58d525c6ddb4aa07603dd69a28c4706",
      "src/msgr/secure.rs": "33e57fc1fa9dd9c7f5a31021823fca1008db3421c018247014af6a75b20bd2cf",
      "src/msgr/session.rs": "a66c46118d08381b00c752b132029fa2ef1188fc96db1a23e19ffb14b3831f8d",
      "src/msgr/supervisor.rs": "d797f1fd1982b3e372ed31e953af94cda383419a02a77664c3970f708167a423",
      "src/msgr/transport.rs": "0ee4b7504805ed85657fe253bbdcdca9a5dfbc92afd17d69b13eb41bf5cbbf3e",
      "src/operation.rs": "a2acc328adb4e77c9f1306275db7e131dfa72506092709acb48d6dc14a909e3b",
      "src/protocol/address.rs": "1d7442f85dbf8b835e262db0257299b8f5d3ecbf89ba82df210de9084fdd4492",
      "src/protocol/errno.rs": "adda487a0b710a6b00b82e31dca54c5959c5bd3575e308db8d19c601d3890792",
      "src/protocol/features.rs": "3577d76b8adba382f526cd8afa0fda51e6caa03b18496c5697290c29b87f422d",
      "src/protocol/mod.rs": "26dd139756a554a2760f2608cbf0abb30e5d041fb404066489026dd4cc5d399b",
      "src/r04_integration.rs": "c5658639f32fadeffeb865cf5438c139bcc61dc00d3e8c5d9cc876022ca30602",
      "src/types.rs": "b43aa65d9f3ac1abc2b6b6cd0b709da173934da0d3af05550ae6a05223aa8f13",
      "src/wire/codec.rs": "1dcae53556dea2f77e602ecfbecef577bd29bf00dc48c1a05ea8f28a0c1f7a4e",
      "src/wire/crc.rs": "1e0e9d48418a5f7e78ee753b1ed843a6f08f41021f6c632e8d58ef28fa131066",
      "src/wire/mod.rs": "13285f9f408224b46833e881c4f1a9bbcf63bc5765e9a4c24857ba0397bd760c"
    }
  },
  "server": {
    "repository": "https://github.com/ceph/ceph.git",
    "source_anchor_commit": "7f793731f1b39eb4f465e960113d2363c311b964",
    "version": "ceph version 20.2.4 (7f793731f1b39eb4f465e960113d2363c311b964) tentacle (stable - RelWithDebInfo)",
    "image": "quay.io/ceph/ceph@sha256:6e6bc7b28fa1b334108a3646af5533dfb50db508efdf5b358eb7dd0dd37a48aa",
    "platform": "linux/arm64",
    "host_platform": "linux/arm64",
    "runtime_package": "ceph-mon-20.2.4-0.el9",
    "monitor_binary_sha256": "4b44a5660fdcc6bf7701f64fa41f707b8ff619d09042219d071e6d9ac45ab81b"
  },
  "cluster": {
    "fsid": "41111111-2222-4333-8444-555555555555",
    "network": "172.30.94.0/24",
    "monitor": "v2:172.30.94.10:3300",
    "client": "172.30.94.20",
    "monitor_name": "a",
    "client_entity": "client.r04",
    "external_config": false,
    "ticket_ttl_seconds": 4
  },
  "scenarios": {
    "secure_authentication": "passed",
    "client_server_ident": "passed",
    "same_session_renewal": "passed",
    "global_id_reuse": "passed",
    "ticket_rotation": "passed",
    "expired_ticket_rejection": "passed",
    "post_expiry_fresh_global_id": "passed",
    "valid_wrong_key_rejection": "passed",
    "secure_default_downgrade_rejection": "passed"
  },
  "negative_observations": {
    "wrong_key": "cephx authentication rejected",
    "downgrade": "cephx auth downgrade rejected"
  },
  "probe": {
    "authenticated_mode": "secure",
    "global_id": 4099,
    "reconnected": true,
    "ticket_renewed": true,
    "initial_ticket_sha256": "db0508be8c0713d382b086dc9c5d2c3568bc95069a62b7b535ef84b3a5fbedcc",
    "renewed_ticket_sha256": "eaadfa1b4bff762d49bbc62cdd0ca5a5c66c30f79e190f9e92594d8a70549075",
    "expiry_rejected": true,
    "expired_reconnect": true,
    "renewed_global_id": 4099,
    "post_expiry_global_id": 4100,
    "server_global_id": 0,
    "server_addresses": [
      "172.30.94.10:3300"
    ],
    "server_features": 4541880224203014143,
    "server_cookie": 0
  }
}
